<?xml version="1.0" encoding="UTF-8"?>
<toolspec model="0.1" xmlns:xsi="http://www.w3.org/2001/XMLSchema-instance" xsi:noNamespaceSchemaLocation="../src/main/resources/toolspec.xsd">
    <id>gppbinarisation</id>
    <name>NCSR GPP Binarisation</name>
    <homepage>http://www.digitisation.eu/tools/browse/image-enhancement/binarisation-and-colour-reduction/ncsr-binarisation/</homepage>
    <version></version>
    <installation>
        <os type="linux">
            Not currently supported.
        </os>
        <os type="windows">
            Requires installation of the NCSR GPP Binarisation Toolkit. THE FULL PATH TO THE EXECUTABLE MUST NOT CONTAIN WHITESPACES!
        </os>
    </installation>
    <services>
        <service sid="1" name="GPPBinarisation" type="migrate" servicepackage="eu.impact_project.iif.service" contextpathprefix="/impactservices">
            <description>Services for document image binarisation using GPP algorithm</description>
            <operations>
                <operation oid="1" name="gppBinarise">
                    <description>Binarise document image using GPP algorithm</description>
                    <!--
                    Usage:
                    gpp.exe <in> <out>

                    Where:
                    <in>    Input image file in TIF format
                    <out>   Bitonal output image file
                    -->
                    <command>gpp.exe ${input} ${output}</command>
                    <inputs>
                        <input name="input">
                            <Datatype>xsd:anyURI</Datatype>
                            <Required>true</Required>
                            <CliMapping>input</CliMapping>
                            <Documentation>URL reference to image file in TIF format</Documentation>
                            <Default>https://github.com/impactcentre/iif-testfiles/raw/master/testfiles/image.tif</Default>
                        </input>
                    </inputs>
                    <outputs>
                        <output name="output">
                            <Datatype>xsd:anyURI</Datatype>
                            <Required>false</Required>
                            <CliMapping>output</CliMapping>
                            <Documentation>URL reference to bitonal output image file</Documentation>
                            <Extension>tif</Extension>
                        </output>
                    </outputs>
                </operation>
            </operations>
            <deployto>
                <deployref default="true" ref="local"/>
            </deployto>
        </service>
    </services>
    <deployments>
        <deployment id="local">
            <identifier>http://localhost:8080/impact/instances/tomcat1</identifier>
            <host>localhost</host>
            <ports>
                <port type="http">8080</port>
                <port type="https">8043</port>
            </ports>
            <manager>
                <user>tomcat</user>
                <password>tomcat</password>
                <path>manager</path>
            </manager>
            <!--
            Full path to the directory where the tool has been installed.
            THE PATH MUST NOT CONTAIN WHITESPACES!
            If you want to use backslashes (\) then you must repeat them twice,
            e.g. c:\\foo\\bar
            or you can use just slashes,
            e.g. c:/foo/bar
            -->
            <toolsbasedir>C:\\GPPBIN\\</toolsbasedir>
            <dataexchange>
                <accessdir>../webapps/ROOT/impact/tmp/</accessdir>
                <accessurl>http://localhost:8080/impact/tmp/</accessurl>
            </dataexchange>
        </deployment>
    </deployments>
</toolspec>
