<?xml version="1.0" encoding="UTF-8"?>
<toolspec model="0.1" xmlns:xsi="http://www.w3.org/2001/XMLSchema-instance" xsi:noNamespaceSchemaLocation="../src/main/resources/toolspec.xsd">
    <id>wordevaluation</id>
    <name>INL Word Evaluation</name>
    <homepage>http://www.digitisation.eu/</homepage>
    <version>1-0</version>
    <installation>
        <os type="linux">
            Fully supported through Java.
        </os>
        <os type="windows">
            Fully supported through Java.
        </os>
    </installation>
    <services>
        <service sid="1" name="WordEvaluation" type="migrate" servicepackage="eu.impact_project.iif.service" contextpathprefix="/impactservices">
            <description>Service for evaluating word accuracy of OCR vs ground truth in PAGE format</description>
            <operations>
                <operation oid="1" name="wordEval">
                    <description>Evaluate OCR word accurracy</description>
                    <!--
                    Usage:
                    java -jar wordevaluation.jar -o <output> <groundtruth> <ocr>

                    Where:
                    <output>        Write output file
                    <groundtruth>   Ground truth file in PAGE format
                    <ocr>           OCR result file in PAGE format
                    -->
                    <command>java -jar wordevaluation.jar -o ${output} ${groundtruth} ${ocrresult}</command>
                    <inputs>
                        <input name="groundtruth">
                            <Datatype>xsd:anyURI</Datatype>
                            <Required>true</Required>
                            <CliMapping>groundtruth</CliMapping>
                            <Documentation>URL reference to ground truth file in PAGE format</Documentation>
                            <Default>https://github.com/impactcentre/iif-testfiles/raw/master/testfiles/groundtruth.xml</Default>
                        </input>
                        <input name="ocrresult">
                            <Datatype>xsd:anyURI</Datatype>
                            <Required>true</Required>
                            <CliMapping>ocrresult</CliMapping>
                            <Documentation>URL reference to OCR result file in PAGE format</Documentation>
                            <Default>https://github.com/impactcentre/iif-testfiles/raw/master/testfiles/ocr.xml</Default>
                        </input>
                        <input name="evaluationId">
                            <Datatype>xsd:string</Datatype>
                            <Required>false</Required>
                            <CliMapping></CliMapping>
                            <Documentation>Evaluation ID</Documentation>
                            <Default>Default_Evaluation_ID</Default>
                        </input>
                    </inputs>
                    <outputs>
                        <output name="output">
                            <Datatype>xsd:anyURI</Datatype>
                            <Required>false</Required>
                            <CliMapping>output</CliMapping>
                            <Documentation>URL reference to statistics output file</Documentation>
                            <Extension>xml</Extension>
                            <OutFileName>output.xml</OutFileName>
                        </output>
                    </outputs>
                </operation>
            </operations>
            <deployto>
                <deployref default="true" ref="local"/>
            </deployto>
        </service>
    </services>
    <deployments>
        <deployment id="local">
            <identifier>http://localhost:8080/impact/instances/tomcat1</identifier>
            <host>localhost</host>
            <ports>
                <port type="http">8080</port>
                <port type="https">8043</port>
            </ports>
            <manager>
                <user>tomcat</user>
                <password>tomcat</password>
                <path>manager</path>
            </manager>
            <!--
            Full path to the directory where the tool has been installed.
            THE PATH MUST NOT CONTAIN WHITESPACES!
            If you want to use backslashes (\) then you must repeat them twice,
            e.g. c:\\foo\\bar
            or you can use just slashes,
            e.g. c:/foo/bar
            -->
            <toolsbasedir></toolsbasedir>
            <dataexchange>
                <accessdir>../webapps/ROOT/impact/tmp/</accessdir>
                <accessurl>http://localhost:8080/impact/tmp/</accessurl>
            </dataexchange>
        </deployment>
    </deployments>
</toolspec>
