<?xml version="1.0" encoding="UTF-8"?>
<toolspec model="0.1" xmlns:xsi="http://www.w3.org/2001/XMLSchema-instance" xsi:noNamespaceSchemaLocation="../src/main/resources/toolspec.xsd">
    <id>fre10binarisation</id>
    <name>ABBYY FineReader Engine 10 Binarisation</name>
    <homepage>http://www.digitisation.eu/tools/browse/image-enhancement/binarisation-and-colour-reduction/abbyy-fr-binarisation/</homepage>
    <version>10</version>
    <installation>
        <os type="linux">
            Not currently supported.
        </os>
        <os type="windows">
            Requires installation of the ABBYY FineReader Engine 10 SDK. THE FULL PATH TO THE EXECUTABLE MUST NOT CONTAIN WHITESPACES!
        </os>
    </installation>
    <services>
        <service sid="1" name="FineReader10Binarisation" type="migrate" servicepackage="eu.impact_project.iif.service" contextpathprefix="/impactservices">
            <description>Services for binarisation using Abbyy Fine Reader Engine 10</description>
            <operations>
                <operation oid="1" name="binarise">
                    <description>Binarise document image file using FineReader 10</description>
                    <!--
                    Usage:
                    Abbyy10Binarisation.exe -if <in> -of <out>

                    Where:
                    <in>    Input image file
                    <out>   Bitonal output image file
                    -->
                    <command>Abbyy10Binarisation.exe -if ${infile} -of ${outfile}</command>
                    <inputs>
                        <input name="infile">
                            <Datatype>xsd:anyURI</Datatype>
                            <Required>true</Required>
                            <CliMapping>infile</CliMapping>
                            <Documentation>URL reference to input image file</Documentation>
                            <Default>https://github.com/impactcentre/iif-testfiles/raw/master/testfiles/image.tif</Default>
                        </input>
                    </inputs>
                    <outputs>
                        <output name="outfile">
                            <Datatype>xsd:anyURI</Datatype>
                            <Required>false</Required>
                            <CliMapping>outfile</CliMapping>
                            <Documentation>URL reference to output bitonal image file</Documentation>
                            <Extension>tif</Extension>
                        </output>
                    </outputs>
                </operation>
            </operations>
            <deployto>
                <deployref default="true" ref="local"/>
            </deployto>
        </service>
    </services>
    <deployments>
        <deployment id="local">
            <identifier>http://localhost:8080/impact/instances/tomcat1</identifier>
            <host>localhost</host>
            <ports>
                <port type="http">8080</port>
                <port type="https">8043</port>
            </ports>
            <manager>
                <user>tomcat</user>
                <password>tomcat</password>
                <path>manager</path>
            </manager>
            <!--
	        Full path to the directory where the tool has been installed.
	        THE PATH MUST NOT CONTAIN WHITESPACES!
	        If you want to use backslashes (\) then you must repeat them twice,
	        e.g. c:\\foo\\bar
	        or you can use just slashes,
	        e.g. c:/foo/bar
	        -->
            <toolsbasedir>C:\\FRE10BIN\\</toolsbasedir>
            <dataexchange>
                <accessdir>../webapps/ROOT/impact/tmp/</accessdir>
                <accessurl>http://localhost:8080/impact/tmp/</accessurl>
            </dataexchange>
        </deployment>
    </deployments>
</toolspec>
