<?xml version="1.0" encoding="UTF-8"?>
<toolspec model="0.1" xmlns:xsi="http://www.w3.org/2001/XMLSchema-instance" xsi:noNamespaceSchemaLocation="../src/main/resources/toolspec.xsd">
    <id>jp2convert</id>
    <name>OpenJPEG JPEG2000 Converter</name>
    <homepage>http://www.openjpeg.org/</homepage>
    <version></version>
    <installation>
        <os type="linux">
            Available under most distributions via package management.
        </os>
        <os type="windows">
            Binaries for Windows are available from the project homepage. THE FULL PATH TO THE EXECUTABLE MUST NOT CONTAIN WHITESPACES!
        </os>
    </installation>
    <services>
        <service sid="1" name="jp2convert" type="migrate" servicepackage="eu.impact_project.iif.service" contextpathprefix="/impactservices">
            <description>Service for converting JPEG2000 images to other image file formats</description>
            <operations>
                <operation oid="1" name="jp2convert">
                    <description>Convert JPEG2000 image file</description>
                    <!--
                    Usage:
                    j2k_to_image -i <input> -o <output> -OutFor <format>

                    Where:
                    <input>     Input file; valid image extensions are J2K, JP2, JPC, JPT
                    <output>    Output file
                    <format>    Output format; currently accepts BMP, TIF, RAW, TGA, PGM, PPM, PNM and PGX
                    -->
                    <command>j2k_to_image -i ${input} -o ${output} -OutFor ${format}</command>
                    <inputs>
                        <input name="format">
                            <Datatype>xsd:string</Datatype>
                            <Required>true</Required>
                            <CliMapping>format</CliMapping>
                            <Documentation>Output image file format</Documentation>
                            <Default>TIF</Default>
                            <Restriction>
                                <Value>BMP</Value>
                                <Value>TIF</Value>
                                <Value>RAW</Value>
                                <Value>TGA</Value>
                                <Value>PGM</Value>
                                <Value>PBM</Value>
                                <Value>PNM</Value>
                                <Value>PGX</Value>
                            </Restriction>
                        </input>
                        <input name="input">
                            <Datatype>xsd:anyURI</Datatype>
                            <Required>true</Required>
                            <CliMapping>input</CliMapping>
                            <Documentation>URL reference to JPEG2000 image file</Documentation>
                            <Default>https://github.com/impactcentre/iif-testfiles/raw/master/testfiles/image.jp2</Default>
                        </input>
                    </inputs>
                    <outputs>
                        <output name="output">
                            <Datatype>xsd:anyURI</Datatype>
                            <Required>false</Required>
                            <CliMapping>output</CliMapping>
                            <Documentation>URL reference to output image file</Documentation>
                            <Extension>tif</Extension>
                        </output>
                    </outputs>
                </operation>
            </operations>
            <deployto>
                <deployref default="true" ref="local"/>
            </deployto>
        </service>
    </services>
    <deployments>
        <deployment id="local">
            <identifier>http://localhost:8080/impact/instances/tomcat1</identifier>
            <host>localhost</host>
            <ports>
                <port type="http">8080</port>
                <port type="https">8043</port>
            </ports>
            <manager>
                <user>tomcat</user>
                <password>tomcat</password>
                <path>manager</path>
            </manager>
            <!--
            Full path to the directory where the tool has been installed.
            THE PATH MUST NOT CONTAIN WHITESPACES!
            If you want to use backslashes (\) then you must repeat them twice,
            e.g. c:\\foo\\bar
            or you can use just slashes,
            e.g. c:/foo/bar
            -->
            <toolsbasedir></toolsbasedir>
            <dataexchange>
                <accessdir>../webapps/ROOT/impact/tmp/</accessdir>
                <accessurl>http://localhost:8080/impact/tmp/</accessurl>
            </dataexchange>
        </deployment>
    </deployments>
</toolspec>
